{
  "schema_version": 1,
  "diagram_type": "ledger",
  "meta": {
    "title": "Northline Coffee — July in the books (GL replay, 2026-07)",
    "output": "northline-gl-2026-07.html",
    "viewBox": [
      1080,
      760
    ],
    "animation": "trace",
    "quality_profile": "showcase",
    "node_style": "logo",
    "views": [
      {
        "id": "order-to-cash",
        "label": "Sales to cash",
        "focus": [
          "dtc-sales-4000",
          "cash-1002",
          "fees-6050"
        ],
        "note": "DTC sales receipts land in cash; Stripe fees leave it as an expense. Wholesale goes through A/R first."
      },
      {
        "id": "cost-side",
        "label": "Cost side",
        "focus": [
          "ap-2000",
          "inventory-1300",
          "cogs-5000"
        ],
        "note": "Green coffee is billed to A/P, held as inventory, and relieved to COGS as it sells."
      },
      {
        "id": "what-did-not-map",
        "label": "What did not map",
        "focus": [
          "cash-1002",
          "payroll-6200"
        ],
        "note": "Payroll is a three-line split (net pay plus withholdings) and is listed as unmapped rather than allocated."
      }
    ]
  },
  "stages": [
    {
      "label": "Sales & receivables"
    },
    {
      "label": "Cash & contra"
    },
    {
      "label": "Owed & held"
    },
    {
      "label": "Expenses"
    }
  ],
  "accounts": [
    {
      "id": "dtc-sales-4000",
      "label": "Sales — DTC",
      "sublabel": "4000 · Shopify receipts",
      "class": "revenue",
      "stage": 0,
      "row": 1,
      "tag": "revenue",
      "brand": "shopify"
    },
    {
      "id": "wholesale-4100",
      "label": "Sales — Wholesale",
      "sublabel": "4100 · invoiced",
      "class": "revenue",
      "stage": 0,
      "row": 2
    },
    {
      "id": "ar-1200",
      "label": "A/R",
      "sublabel": "1200 · wholesale only",
      "class": "asset",
      "stage": 0,
      "row": 4
    },
    {
      "id": "cash-1002",
      "label": "Cash 1002",
      "sublabel": "Chase operating account",
      "class": "asset",
      "cash": true,
      "stage": 1,
      "row": 1,
      "height": 96,
      "yOffset": -19,
      "tag": "cash SoT",
      "brand": "chase"
    },
    {
      "id": "refunds-4900",
      "label": "Refunds & allowances",
      "sublabel": "4900 · contra revenue",
      "class": "contra",
      "stage": 1,
      "row": 3
    },
    {
      "id": "inventory-1300",
      "label": "Inventory",
      "sublabel": "1300 · green coffee",
      "class": "asset",
      "stage": 2,
      "row": 0
    },
    {
      "id": "ap-2000",
      "label": "A/P",
      "sublabel": "2000 · bills",
      "class": "liability",
      "stage": 2,
      "row": 1
    },
    {
      "id": "cogs-5000",
      "label": "COGS",
      "sublabel": "5000",
      "class": "expense",
      "stage": 3,
      "row": 0
    },
    {
      "id": "fees-6050",
      "label": "Merchant fees",
      "sublabel": "6050 · Stripe",
      "class": "expense",
      "stage": 3,
      "row": 2,
      "brand": "stripe"
    },
    {
      "id": "payroll-6200",
      "label": "Payroll",
      "sublabel": "6200",
      "class": "expense",
      "stage": 3,
      "row": 3
    },
    {
      "id": "shipping-6100",
      "label": "Shipping & supplies",
      "sublabel": "6100",
      "class": "expense",
      "stage": 3,
      "row": 4
    }
  ],
  "entities": [
    {
      "id": "ent-dtc-customers",
      "label": "Shopify DTC customers",
      "class": "customer",
      "sublabel": "sales receipts, refunds"
    },
    {
      "id": "ent-bluebottle",
      "label": "Blue Bottle Wholesale",
      "class": "customer",
      "sublabel": "invoiced, pays by ACH"
    },
    {
      "id": "ent-harbor",
      "label": "Harbor Grocery Co-op",
      "class": "customer",
      "sublabel": "invoiced, pays by ACH"
    },
    {
      "id": "ent-importadora",
      "label": "Cafe Importadora SA",
      "class": "vendor",
      "sublabel": "green coffee"
    },
    {
      "id": "ent-other-vendors",
      "label": "Other vendors",
      "class": "vendor",
      "grouped": 3,
      "sublabel": "Uline, Pacific Roasting Supply, Bay Freight"
    },
    {
      "id": "ent-stripe",
      "label": "Stripe",
      "class": "processor",
      "sublabel": "card processing fees"
    },
    {
      "id": "ent-chase",
      "label": "Chase Bank",
      "class": "bank",
      "sublabel": "operating account 1002"
    },
    {
      "id": "ent-employees",
      "label": "Employees",
      "class": "employee",
      "grouped": 7,
      "sublabel": "semi-monthly payroll"
    },
    {
      "id": "ent-state-dor",
      "label": "State Dept. of Revenue",
      "class": "government",
      "sublabel": "payroll tax withholdings"
    }
  ],
  "flows": [
    {
      "id": "dtc-sale",
      "from": "dtc-sales-4000",
      "to": "cash-1002",
      "label": "sales receipt",
      "variant": "emphasis"
    },
    {
      "id": "wholesale-invoice",
      "from": "wholesale-4100",
      "to": "ar-1200",
      "label": "invoice",
      "variant": "dashed",
      "classification": "accrual",
      "fromSide": "bottom",
      "toSide": "top",
      "labelAt": [
        120,
        499
      ]
    },
    {
      "id": "ach-received",
      "from": "ar-1200",
      "to": "cash-1002",
      "label": "ACH received",
      "variant": "emphasis",
      "route": "vertical-channel",
      "channelX": 262
    },
    {
      "id": "refund-paid",
      "from": "cash-1002",
      "to": "refunds-4900",
      "label": "refund paid",
      "variant": "security",
      "classification": "contra",
      "fromSide": "bottom",
      "toSide": "top",
      "labelAt": [
        370,
        394
      ]
    },
    {
      "id": "bill-payment",
      "from": "cash-1002",
      "to": "ap-2000",
      "label": "bill paid",
      "variant": "emphasis",
      "route": "vertical-channel",
      "channelX": 478
    },
    {
      "id": "stripe-fee",
      "from": "cash-1002",
      "to": "fees-6050",
      "label": "processing fee",
      "route": "vertical-channel",
      "channelX": 490,
      "labelSegment": 2
    },
    {
      "id": "payroll-run",
      "from": "cash-1002",
      "to": "payroll-6200",
      "label": "payroll run",
      "route": "vertical-channel",
      "channelX": 502,
      "labelSegment": 2
    },
    {
      "id": "shipping-paid",
      "from": "cash-1002",
      "to": "shipping-6100",
      "label": "supplies paid",
      "route": "vertical-channel",
      "channelX": 514,
      "labelSegment": 2
    },
    {
      "id": "bill-recorded",
      "from": "ap-2000",
      "to": "inventory-1300",
      "label": "bill recorded",
      "variant": "dashed",
      "classification": "accrual",
      "fromSide": "top",
      "toSide": "bottom",
      "labelAt": [
        620,
        214
      ]
    },
    {
      "id": "cost-of-goods",
      "from": "inventory-1300",
      "to": "cogs-5000",
      "label": "relieved to COGS",
      "variant": "dashed",
      "classification": "accrual"
    }
  ],
  "ledger": {
    "period": {
      "start": "2026-07-01",
      "end": "2026-07-31"
    },
    "currency": "USD",
    "proof": "csv",
    "amounts": true,
    "source": {
      "kind": "gl",
      "system": "QuickBooks",
      "file": "northline-gl-2026-07.csv",
      "sha256": "7c9b24055a1a6c65a903c2aeb2aa150daaff4427a52593896627686301a99a09",
      "rows": 72
    },
    "opening": {
      "cash-1002": 18240.55
    },
    "playback": {
      "daysPerSecond": 2
    },
    "tieouts": [
      {
        "id": "cash-vs-statement",
        "label": "Cash 1002 net movement vs bank statement",
        "node": "cash-1002",
        "expected": 12245.36
      },
      {
        "id": "ar-vs-aging",
        "label": "A/R net movement vs aging report",
        "node": "ar-1200",
        "expected": 2240
      }
    ],
    "events": [
      {
        "id": "je-412",
        "date": "2026-07-01",
        "edge": "dtc-sale",
        "kind": "journal",
        "amount": 1842.1,
        "entity": "ent-dtc-customers",
        "ref": "JE-412",
        "memo": "Shopify sales receipt batch 07/01",
        "row": 2
      },
      {
        "id": "je-413",
        "date": "2026-07-03",
        "edge": "dtc-sale",
        "kind": "journal",
        "amount": 1210.55,
        "entity": "ent-dtc-customers",
        "ref": "JE-413",
        "memo": "Shopify sales receipt batch 07/03",
        "row": 4
      },
      {
        "id": "je-414",
        "date": "2026-07-06",
        "edge": "dtc-sale",
        "kind": "journal",
        "amount": 2044,
        "entity": "ent-dtc-customers",
        "ref": "JE-414",
        "memo": "Shopify sales receipt batch 07/06",
        "row": 6
      },
      {
        "id": "je-415",
        "date": "2026-07-09",
        "edge": "dtc-sale",
        "kind": "journal",
        "amount": 1568.3,
        "entity": "ent-dtc-customers",
        "ref": "JE-415",
        "memo": "Shopify sales receipt batch 07/09",
        "row": 8
      },
      {
        "id": "je-416",
        "date": "2026-07-13",
        "edge": "dtc-sale",
        "kind": "journal",
        "amount": 1930.75,
        "entity": "ent-dtc-customers",
        "ref": "JE-416",
        "memo": "Shopify sales receipt batch 07/13",
        "row": 10
      },
      {
        "id": "je-417",
        "date": "2026-07-16",
        "edge": "dtc-sale",
        "kind": "journal",
        "amount": 1402.2,
        "entity": "ent-dtc-customers",
        "ref": "JE-417",
        "memo": "Shopify sales receipt batch 07/16",
        "row": 12
      },
      {
        "id": "je-418",
        "date": "2026-07-20",
        "edge": "dtc-sale",
        "kind": "journal",
        "amount": 2215.4,
        "entity": "ent-dtc-customers",
        "ref": "JE-418",
        "memo": "Shopify sales receipt batch 07/20",
        "row": 14
      },
      {
        "id": "je-419",
        "date": "2026-07-23",